{
  "contract": {
    "id": "CT-PLN-001",
    "version": "1.0.0"
  },
  "plan_id": "PLN-2026-000001",
  "request_id": "REQ-2026-000001",
  "plan_version": "1.0.0",
  "primary_intent": "Wi-Fiルーターの電気代を知る",
  "supporting_intents": [
    "節電方法を知る"
  ],
  "main_answer": "一般的な家庭用ルーターの電気代は月数百円以内が目安",
  "reader_model": {},
  "content_requirements": [
    {
      "id": "CR-001",
      "description": "月額と年額の目安",
      "priority": "must",
      "evidence_required": true
    }
  ],
  "article_structure": [
    {
      "heading": "Wi-Fiルーターの電気代",
      "level": 1,
      "purpose": "主題提示"
    },
    {
      "heading": "月額と年額の目安",
      "level": 2,
      "purpose": "直接回答"
    }
  ],
  "evidence_plan": [],
  "out_of_scope": [],
  "quality_targets": [
    "publish_ready"
  ],
  "planning_gate_status": "pass"
}